{
  "kind": "decision",
  "schema_version": "1.0.0",
  "id": "DEC-NEXT",
  "record_status": "EXAMPLE",
  "created_at": "2026-09-11T23:19:57.136661+00:00",
  "subject_ref": "RELAYSUITE",
  "authority_ref": "SCENARIO-MANDATE-NOT-ACTUAL-AUTHORITY",
  "disposition": "NARROW",
  "status": "PROPOSED",
  "evidence_refs": [
    "EV-SCENARIO"
  ],
  "alternatives": [
    "Repair the shared versioned contract",
    "Ship a coordinated package set",
    "Merge tightly coupled components into one repository",
    "Narrow the promised rollout compatibility"
  ],
  "rationale": "Repair the contract boundary under one integration owner, then re-run actual serialization and supported version-skew paths.",
  "resource_envelope_ref": "SCENARIO-ONLY-NO-REAL-BUDGET",
  "reversal_condition": "Pause new component splitting until a passing integrated baseline and a coherent boundary justification exist.",
  "execution_receipt_refs": []
}
